社名,電話番号,所在地,代表者,事業内容,企業URL
株式会社ソラスト,03-5904-5191,東京都港区港南2-15-3品川インターシティC棟12階,野田亨,医療事業介護事業こども事業,https://www.solasto.co.jp/
社会福祉法人奉優会,03-5383-1111,東京都世田谷区駒沢1-4-15真井ビル5階,香取寛,特別養護老人ホームケアハウス短期入所生活介護一般型通所介護認知症対応型通所介護高齢者福祉センター地域ケアプラザ訪問介護居宅介護支援事業地域包括支援センター認知症対応型共同生活介護小規模多機能型居宅介護,https://www.foryou.or.jp/
パーソナルエージェントホールディングス株式会社,03-5428-3605,,,,
シャロム株式会社,03-6265-0172,,,,
有限会社アミューザ,03-3269-7677,東京都新宿区神楽坂６‐２４コーリンビル１Ｆ,東節子,,
株式会社HYV（ハイヴ）,,東京都目黒区下目黒1-8-1ARCOTOWER17F,茅野航平,ピラティス専門スタジオ運営・スポーツ用品販売・サプリメント等販売・トレーナー養成・トレーニング指導,https://the-silk.co.jp/
株式会社仙,03-5206-7188,東京都新宿区神楽坂6-68イグレックビル3階,大澤誠二,美容室、美容専門アカデミー運営イグレックブランドのフランチャイズ運営管理など,https://www.igrekparis.com/
医療法人社団鉄友会柳町病院,03-3268-3521,東京都新宿区市谷柳町25番地,佐藤周三,内科・循環器内科・呼吸器内科・消化器内科外科・整形外科・リハビリテーション科泌尿器科・皮膚科・小児科,http://www.yanagicho-hp.or.jp/
東和フードサービス株式会社,03-6280-7236,東京都港区新橋3-20-1TOWAJ’Sビル6階,岸野誠人,フード(外食)事業／喫茶・カフェ、レストランの店舗運営,https://www.towafood-net.co.jp/shop/cafe/
医療法人社団桜芳会やよい歯科クリニック,03-3207-3442,東京都新宿区弁天町23イグレックビル1F,米澤弥生,歯科診療,https://yayoi-shika.com/
株式会社ソラスト,03-5206-7317,東京都港区港南2-15-3品川インターシティC棟12階,野田亨,医療事業介護事業こども事業,https://www.solasto.co.jp/
株式会社コパン,0774-24-2008,岐阜県多治見市光が丘二丁目60番地の1,市岡道隆,<スポーツ関連>スポーツクラブ事業/スイミングスクール事業/受託運営事業/コンサルティング事業/サッカー事業/テニス事業<その他>エステ事業/学童保育事業/旅行事業,https://www.copin.co.jp/
ジュビラン株式会社,0774-21-7010,大阪府大阪市中央区城見2丁目1-61ツイン21MIDタワー25F,揚村聖司,化粧品卸、エステティックサロンの展開,https://www.bc-jubilant.co.jp/
有限会社わかはやし美容室,0774-22-3212,京都府宇治市神明宮西37-25,若林由佳,,https://wakahayashi.co.jp/
有限会社わかはやし美容室,0774-22-8684,京都府宇治市神明宮西37-25,若林由佳,,https://wakahayashi.co.jp/
株式会社はあと,070-8329-1994,京都府京都市下京区鍵屋町347-3,小原麻央,ネイルサロン・美容製品開発及び販売・フランチャイズ運営,https://heartnail.jp/
医療法人仁心会宇治川病院,,京都府宇治市小倉町老ノ木31,葉山典泰,内科、外科、整形外科、眼科、耳鼻咽頭科、皮膚科等,https://jinshinkai.or.jp/index.html
医療法人仁心会宇治川病院,0774-85-0820,京都府宇治川市小倉町老ノ木31,葉山典泰,内科、外科、整形外科、眼科、耳鼻咽頭科、皮膚科等,https://jinshinkai.or.jp/organization/visit_nurse/index.html
株式会社サイゼリヤ,0774-28-1281,埼玉県吉川市旭2番地10,正垣泰彦,イタリア料理店「サイゼリヤ」をチェーン展開するフードサービス業,https://www.saizeriya.co.jp/corporate/
医療法人谷歯科医院,,京都府宇治市宇治下居5番地谷ビル,谷昇,,https://tani-dental.com/medical/index.html
にしむら歯科医院,03-3745-2681,京都府宇治市莵道谷下り19-5,西村良一,,http://nishimura-dentalclinic.jp/
BWコンサルティング株式会社,059-325-7262,東京都豊島区東池袋1-34-5いちご東池袋ビル203,青木涼太,経営コンサルティング事業、デジタルマーケティング事業、飲食事業、美容サロン事業、不動産事業、ITコンサルティング事業、システム開発,https://www.bw-c.com/
株式会社レジェンドプロモーション,03-5391-6456,,,,
I・BiJiN（あいびじん）,059-355-8008,,,,http://www.ibijin.jp/ibijin_home/
ケアーズ訪問看護リハビリステーションあやめ,059-337-9992,,,,
株式会社夢眠ホーム,059-332-1156,愛知県名古屋市東区泉三丁目7番9号グランエールサノヤ3F,佐藤信輔,,http://muminhome.jp/
アイビーカンパニー株式会社,059-354-7975,東京都渋谷区千駄ヶ谷2-11-3,塚田龍平,レストラン、ティールーム、パティスリーなどの運営、ならびにパン、菓子などの製造販売,https://www.afternoon-tea.net/
株式会社ココスジャパン,059-330-6301,東京都品川区東品川2-2-20天王洲オーシャンスクエア8F,一木直哉,ファミリーレストラン「ココス」、メキシカンレストラン「エルトリート」の経営を行っております。,https://www.cocos-jpn.co.jp/
医療法人にいみ歯科医院,059-353-5580,三重県四日市市北浜田町3-5,新美敦司,歯科・小児歯科・インプラント・審美歯科・歯周病治療・総入れ歯・予防歯科・定期健診・矯正歯科・口腔外科,https://www.niimi-shika.com/
有限会社あーきぺんこ,059-350-1123,三重県桑名市中央町5-38グランドメゾン桑名1-1405,竹内祐子,,https://www.artkey-p.com/
株式会社ティアラ,059-329-7137,三重県四日市市鵜の森一丁目3番2号,武藤佳寿子,,
shucre株式会社,,岐阜県岐阜市柳津町北塚5-24-1シェラトン広瀬,大谷真千子,,
株式会社フルキャスト,03-4530-4848,,,,
株式会社ヴィラ,0598-30-8308,広島県呉市広本町1-13-1タクミビル5F,谷規正,・リラクゼーションサロンの運営・経営・フランチャイズ業・リラクゼーションサロンコンサルティング業・エステ事業・FC本部構築事業（フランチャイズ展開本部構築）・セラピスト養成スクール事業,https://www.asian-relaxation-villa.com/company/
LANDMARC,0598-21-0544,三重県松阪市大黒田町1257,,,https://landmarc.jp/salon/landmarc/
医療法人医王寺会,0598-31-3480,三重県松阪市立野町200,良雪雅,外来・訪問診療・訪問看護・居宅支援事業所・訪問介護,https://ioji.org/aboutclinic/
株式会社サイゼリヤ,0598-25-6517,埼玉県吉川市旭2番地11,正垣泰彦,イタリア料理店「サイゼリヤ」をチェーン展開するフードサービス業,https://www.saizeriya.co.jp/corporate/
株式会社マックスコムズウエストトライコムズ・カットコムズ,076-443-5311,富山県富山市田中町1丁目16番40号,前川政光,トライコムズ／カットコムズの運営,https://www.cutcomz.jp/recruit/
株式会社LMLand,0598-51-1110,三重県松阪市下村町６１６‐７０,,美容室,https://landmarc.jp/
株式会社INHERSHOES,0598-67-5075,三重県松阪市宮町237グランマツサカ1号室,大内一馬,放課後等デイサービスインハーシューズの運営,
三重県厚生農業協同組合連合会松阪中央総合病院,0598-21-5252,三重県松阪市川井町字小望102,田端正己,医療関連事業介護事業保育事業ヘルスケア事業,http://www.miekosei.or.jp/1_mch/doremi/navi/doremi_1.html
ojo,059-229-3883,三重県津市大門27-13,松波和宏,美容院の経営,
バリー・エージェンシー有限会社,059-227-5868,,,,
株式会社ベストプロバイド,059-261-9899,,,,
株式会社ニチイ学館,042-656-6290,東京都千代田区神田駿河台4-6御茶ノ水ソラシティ,森信介,医療関連事業介護事業保育事業ヘルスケア事業,https://www.nichiigakkan.co.jp/
株式会社サイゼリヤ,059-221-5788,埼玉県吉川市旭2番地12,正垣泰彦,イタリア料理店「サイゼリヤ」をチェーン展開するフードサービス業,https://www.saizeriya.co.jp/corporate/
宮﨑デンタルオフィス,592-284-974,三重県津市広明町341,宮﨑正憲,,https://www.miyazaki-dental.net/
おおさわ歯科矯正歯科医院,059-222-2000,三重県津市中央13-4,大澤雅輝,,https://osawa-dc.jp/doctor/
Calm,059-229-3883,三重県津市大門27-13,松波和宏,美容院の経営,
社会福祉法人自由学苑福祉会,059-226-3131,三重県津市大谷町240,大川吉崇,幼稚園、学校等の経営,https://www.ohkawa-gakuen.ac.jp/
社会福祉法人上浜福祉会,,三重県津市一身田中野４２３番地,船木泉,保育園の経営,https://www.sunalix.co.jp/kamihamahoikuen/
株式会社MAQUIA,03-5990-5806,東京都新宿区西新宿6-15-1セントラルパークタワー・ラ・トゥール新宿509号室,日比野洋平,,https://e-maquia.jp/company.html
株式会社アートネイチャー,0265-23-2325,東京都渋谷区代々木3-40-7,五十嵐祥剛,各種毛髪製品の製造販売増毛・育毛サービスの提供ヘアケア商品の販売,https://corp.artnature.co.jp/ja/corporation/outline.html
株式会社Affection,0265-48-8124,長野県飯田市中央通り2-1,岡島正和,,https://hp.kaipoke.biz/4yz/info.html
株式会社モンテローザ,0265-23-4988,東京都杉並区梅里1-21-15モンテローザ本社ビル,大神輝博,飲食事業を中心とする傘下子会社の経営管理,https://www.monteroza.co.jp/company/profile/
株式会社ココスジャパン,0265-56-0268,東京都品川区東品川2-2-20天王洲オーシャンスクエア8F,一木直哉,ファミリーレストラン「ココス」、メキシカンレストラン「エルトリート」の経営を行っております。,https://www.cocos-jpn.co.jp/
マツザワホールディングス株式会社,0265-22-8188,長野県下伊那郡高森町下市田3123番地,松澤徹,グループ会社の経営指導,https://www.matsuzawa-holdings.co.jp/
株式会社チアーズダイニング,050-1809-3994,神奈川県横浜市西区みなとみらい2-2-1ランドマークタワー12階,澄川浩太,飲食店・小売店の運営,https://cheersdining.co.jp/
株式会社ハマ,072-349-4848,大阪府松原市上田2-7-23,濱屋勉,,https://prana-hama.jp/
社会福祉法人和順福祉会,0265-22-2389,長野県飯田市丸山町2-6728番地,宮澤徹成,,http://www.wajun.ed.jp/
社会福祉法人和順福祉会,0265-22-2389,長野県飯田市丸山町2-6728番地,宮澤真由美,,http://www.wajun.ed.jp/
株式会社MAQUIA,03-5990-5806,東京都新宿区西新宿6-15-1セントラルパークタワー・ラ・トゥール新宿509号室,日比野洋平,,https://e-maquia.jp/company.html
株式会社フレアス,0254-38-0665,東京都品川区西五反田二丁目27番3号A-PLACE五反田3F,澤登拓,マッサージ事業マッサージフランチャイズ事業施設系介護サービス事業その他の事業,https://fureasu.jp/
社会福祉法人愛宕福祉会,025-384-2941,新潟市東区大山2丁目13番34号,石崎昂一,第一種社会福祉事業第二種社会福祉事業公益を目的とする事業収益を目的とする事業,https://www.atago.or.jp/
株式会社サルーン,0254-26-2029,新潟県三条市石上1丁目4－12,石丸真太郎,外食サービス業[ステーキとハンバーグの専門店],https://saloon-group.co.jp/
チムニー株式会社,,東京都墨田区両国3丁目22-6雷電ビル6F・7F・8F,山内英靖,「はなの舞」「さかなや道場」「魚鮮水産」他、直営およびフランチャイズチェーン展開,https://www.chimney.co.jp/
株式会社モンテローザ,0254-23-0788,東京都杉並区梅里1-21-15モンテローザ本社ビル,大神輝博,飲食事業を中心とする傘下子会社の経営管理,https://www.monteroza.co.jp/company/profile/
遠藤歯科クリニック,0254-24-0100,新潟県新発田市荒町甲1456-3,,,
株式会社AB&Company,0254-28-7823,東京都新宿区新宿二丁目16番6号新宿イーストスクエアビル6階,市瀬一浩,直営美容室運営事業フランチャイズ事業インテリアデザイン事業,https://ab-company.co.jp/jp/
HairLifeKONIKONI,0254-20-8451,新潟県新発田市緑町１丁目５番９号,大倉明俊,,https://www.hairlife-konikoni.com/home
放課後等デイサービスオハナ新発田,0254-28-7124,新潟県新発田市五十公野4837-7,,,https://ohana-shibata.com/
株式会社ライブパワー,03-5436-9100,東京都目黒区下目黒2-19-3IMAS目黒ビル5F,小崎滋之,コンサート、イベントにおける会場案内、警備、運営業務,https://www.livepower.co.jp/
株式会社ステラ,049-288-0087,埼玉県越谷市蒲生寿町５-８,花形篤志,,https://stella.salon/
プリズムヘアーデザイン株式会社,049-289-3968,埼玉県富士見市西みずほ台２-１２-１エクレシア101,鈴木洋平,施術を中心としたサロン内業務全般、施術・受付・カウンセリング等のサロン内業務,https://www.prismhair.net/
株式会社学研ココファン,049-284-4500,東京都品川区西五反田2－11－8学研ビル,森猛,サービス付き高齢者向け住宅の企画・開発・運営、指定居宅サービス事業、指定居宅介護支援事業、フランチャイズ事業、不動産賃貸に関する事業、その他付帯する一切の事業,https://www.cocofump.co.jp/
株式会社フライングガーデン,049-272-3321,栃木県小山市本郷町三丁目4番18号,野沢八千万,レストランチェーン事業,http://www.fgarden.co.jp/
株式会社すかいらーくホールディングス,049-288-2013,東京都武蔵野市西久保1-25-8（三鷹第3オフィス）,谷真,フードサービス事業全般、その他周辺事業,https://corp.skylark.co.jp/
医療法人オーク坂戸歯科,049-280-3355,埼玉県坂戸市日の出町2-15,柏木康志,,http://oak-dent.com/introduction.html
もりや歯科,049-280-5117,埼玉県坂戸市伊豆の山町4-57,森谷良行,,https://moriyashika.com/
株式会社オーガニック,049-280-5200,埼玉県坂戸市日の出町14-3山咲ビル204,延谷彰,美容業,https://hairmakeorganic.com/
株式会社P’scolony,049-227-3605,埼玉県坂戸市芦山町13-6,高野有生,児童福祉法による障害児通所支援事業,https://ps-colony.com/
エクラ株式会社,048-487-9733,東京都練馬区北町2-41-3北町ビル3F,森田洋輔,まつげ専門サロンの運営,https://eclat.link/
株式会社フレイム株式会社トレッドル,050-5875-8797,埼玉県川口市並木3-4-4東京都板橋区大山金井町51-5林ビル1F,舟津隆一,美容室事業／FC事業／商品開発／不動産事業／タオルリース事業／コンサルタント事業／社会貢献活動,https://frames.co.jp/
さいたま胃腸内視鏡と肝臓のクリニック和光市駅前院,050-3733-2013,埼玉県和光市丸山台１丁目１０－２０M.Nビル３階４階,吉良文孝,,https://wakoshi-naika.com/
医療法人彩瑛会,048-424-2841,埼玉県朝霞市青葉台1-3-2青葉台メディカルプラザ1F,横部旬哉,,https://aobadai-seikei.co.jp/
株式会社すかいらーくホールディングス,048-451-5171,東京都武蔵野市西久保1-25-8（三鷹第3オフィス）,谷真,フードサービス事業全般、その他周辺事業,https://corp.skylark.co.jp/
株式会社銀座ルノアール,048-465-7520,東京都中野区中央4丁目60番3号銀座ルノアールビル,猪狩安往,飲食店の経営食料品の製造・加工及び販売フランチャイズチェーン店の経営及び技術指導,https://www.ginza-renoir.co.jp/
笹尾歯科医院,048-467-7651,埼玉県和光市本町２-８レイボープラザ３０７,笹尾道昭,一般歯科、矯正歯科、予防歯科,https://sahoo.jp/spic/
栗原歯科,048-468-0008,埼玉県朝霞市本町1-29-43,栗原健二,一般歯科、矯正歯科、予防歯科,https://kurihara-dental.net/
合同会社ニシオ,048-423-2784,埼玉県朝霞市本町２－１－７パークハイム朝霞,西尾正範,整骨院、整体院、障害児通所施設の運営,https://astellas-asaka.com/
株式会社Crossvi,054-636-6670,愛知県名古屋市中村区大秋町2-52-1,加藤真紀,まつげエクステサロン、ネイルサロ,http://coco-coco.com/index.html
株式会社マルタカテクノ,054-644-5475,静岡県藤枝市八幡字広通550-1,大河原吉貴,電気製品・医療機器・介護機器・寝装寝具・健康機器の開発/製造/販売及び輸出入・化粧品・医薬部外品の販売,https://www.marutakatechno.co.jp/
株式会社Felice,03-6277-0739,静岡県藤枝市駅前2-19-15アクセスビル2階,大池由香,医療・福祉サービス,
株式会社すかいらーくホールディングス,0570-021-035,東京都武蔵野市西久保1-25-8（三鷹第9オフィス）,金谷実,フードサービス事業全般、その他周辺事業,https://corp.skylark.co.jp/about/profile/
そのだ歯科・口腔外科クリニック,054-647-6006,静岡県藤枝市瀬戸新屋244-2,薗田直志,,https://sonoda-oralsurgery.com/
池谷歯科医院,054-643-6171,,,,
株式会社AB&Company,054-625-8587,東京都新宿区新宿二丁目16番6号新宿イーストスクエアビル6階,市瀬一浩,直営美容室運営事業フランチャイズ事業インテリアデザイン事業,https://ab-company.co.jp/jp/
一般社団法人B.S.D／BeautistSustainableDevelopment,054-631-7399,東京都港区北青山3-6-21青山岡田ビル9F,鈴木浩一朗,,https://bsd.or.jp/
のんのん英育会,054-636-7731,藤枝市青木2-23-17山田ビル2階,山田則子,,
株式会社NaPS,03-6905-7703,東京都板橋区板橋1-53-10柏瀬マンション2A,渡辺淳,"ネイルサロン,まつげエクステサロン,ホワイトニング",http://naplovers.jp/shop/
パーソナルエージェントホールディングス株式会社,03-5428-3605,,,,
株式会社Luce,03-6886-9509,,,,https://luce-naileyelash.com/
合同会社サン・ルーチェ,03-6914-3069,東京都豊島区東池袋1-34-1広告塔センタービル7F,,ネイルサロンの経営,https://mailo.official.jp/
氷川町整形外科・皮ふ科,03-6915-5852,東京都板橋区氷川町２６－１ベールクレール1階,城所宏次,整形外科、皮膚科、リハビリテーション科、スポーツ整形外科、美容皮膚科,https://hsh-cl.sakura.ne.jp/1top.html
株式会社すかいらーくホールディングス,0422-51-8111,東京都武蔵野市西久保1-25-8（三鷹第9オフィス）,金谷実,フードサービス事業全般、その他周辺事業,https://corp.skylark.co.jp/about/profile/
東板橋歯科クリニック,03-6905-7261,東京都板橋区板橋４−６２−６,高坂晋哉,一般歯科、小児歯科、歯科口腔外科、矯正歯科、SAS睡眠時無呼吸症候群、顎顔面補綴,https://higashiitabashi-dental.com/index.html
北大塚歯科医院,03-5907-8500,東京都豊島区北大塚3-30-8ロータス北大塚1F,齋藤裕史,一般歯科、審美治療、小児歯科、訪問診療,https://kitaotsuka-dc.com/
株式会社ポピンズエデュケア,03-5957-2145,東京都渋谷区広尾5丁目6番6号広尾プラザ,田村篤司,子育て支援サービス、子育て事業コンサルティング,https://www.poppins.co.jp/educare/
ぬくもりのおうち保育株式会社,03-5980-8531,大阪市淀川区西中島6丁目7-54階,濵田和人,認可保育園・企業主導型保育園の運営,https://www.nukumorinoouchi.com/
CANEYELASH,080-8730-6024,名古屋市北区大曽根3-10-8,,,https://caneyelash.hp.peraichi.com/
インザライフ株式会社,054-284-5217,,,,
sistoi,052-908-1930,,,,
株式会社リジェール,052-908-7703,愛知県名古屋市西区則武新町1-3-3,野村昌広,,https://www.rejouir.ne.jp/
ヒューマンライフケア株式会社,052-991-5166,東京都新宿区西新宿7-5-25西新宿プライムスクエア1F,瀬戸口信也,介護事業（ヒューマンライフケア）ケアプラン作成（居宅介護支援）ホームヘルプサービス（訪問介護）デイサービス（通所介護）小規模多機能型居宅介護看護小規模多機能型居宅介護グループホーム（認知症対応型共同生活介護）介護付有料老人ホーム（特定施設入居者生活介護）ホスピスホーム訪問マッサージシニアライフ事業（福祉用具貸与・販売ほか）デイサービスフランチャイズ介護教育事業介護人材育成等各種研修プログラム運営外国人介護人材教育サービス特定技能登録支援事業※子育て支援事業（ヒューマンアカデミー保育園）はヒューマンアカデミー株式会社へ事業移管いたしました,https://human-lifecare.jp/company/data/
みずのリハビリクリニック,052-917-8008,愛知県名古屋市北区上飯田南町3-92-2,水野雅康,,https://mizunorehacl.com/index.html
株式会社嘉文,052-910-7888,名古屋市南区明治2丁目4番6号,加藤文隆,,https://www.kamon-group.com/
株式会社すかいらーくホールディングス,0570-012-264,東京都武蔵野市西久保1-25-8（三鷹第9オフィス）,金谷実,フードサービス事業全般、その他周辺事業,https://corp.skylark.co.jp/about/profile/
さくら矯正歯科,052-914-9821,愛知県名古屋市北区上飯田南町3－89－2,伊藤亜紀子,,https://sakura-kyousei.com/
株式会社アイ・エス・シー,050-1751-1420,東京都千代田区平河町2-6-1平河町ビル1F,山本直美,保育事業発達支援事業教育プログラム販売事業（WithBook事業）子ども向け商品開発支援・コンサルティング企業向け子育て支援プログラムの提供他,https://isc-ac.jp/
株式会社Crossvi,0569-21-0088,愛知県名古屋市中村区大秋町２丁目５３番地の１,加藤真紀,まつげパーマまつげエクステアイブロウ眉WAXネイル,http://coco-coco.com/index.html
株式会社フルキャストホールディングス,052-586-0044,東京都品川区西五反田8-9-5FORECAST五反田WEST12F,坂巻一樹,人材アウトソーシング事業労働者派遣事業許可番号（派）13-010733職業紹介事業許可番号13-ユ-010325,https://www.fullcast.co.jp/
有限会社MASA,0569-24-3002,愛知県東海市荒尾町山王前20番地,伊藤昌弘,,https://m-wish.jp/
株式会社デューアソシエ,0569-26-5656,名古屋市中区松原一丁目13-9D&Aビルディング,日比谷美奈子,,https://www.dewpoint.jp/
株式会社エス・エム・エス,0569-23-1155,東京都港区芝公園2-11-1住友不動産芝公園タワー,後藤夏樹,,https://www.bm-sms.co.jp/
尾之内ONE歯科クリニック,0569-21-8811,愛知県半田市住吉町４丁目９５−１,尾之内俊秀,,https://onouchi-dc.com/
石黒歯科医院,0569-22-0088,愛知県半田市浜田町3-3-1,石黒長一,,https://www.ishiguro-dc.com/
株式会社ジョイハント,0569-84-4032,愛知県半田市栄町四丁目６５番地,前田悠貴,放課後等デイサービス,
株式会社Msfamily,0562-57-5688,愛知県半田市船入町20,間瀬博吉,,
株式会社ケン＆スタッフ,03-3367-0020,,,,
合同会社サンクレスト,047-497-8443,千葉県船橋市薬円台1-5-9エムワンテラス103,高木隆二,美容室の経営,
ＳＯＭＰＯホールディングス株式会社,0120-371-865,東京都新宿区西新宿1-26-1,奥村幹夫,当会社は、次の事業を営むことを目的とする。（１）損害保険会社、生命保険会社その他の保険業法の規定により子会社等とした会社の経営管理（２）その他前号の業務に附帯する業務（３）前２号に掲げる業務のほか、保険業法の規定により保険持株会社が営むことのできる業務,https://www.sompo-hd.com/
株式会社すかいらーくホールディングス,047-490-3106,東京都武蔵野市西久保1-25-8,谷真,フードサービス事業全般、その他周辺事業,https://corp.skylark.co.jp/
株式会社コメダ,047-496-2288,愛知県名古屋市東区葵三丁目12番23号,甘利祐一,コーヒーショップおよびフランチャイズチェーンの経営,https://www.komeda.co.jp/company/outline.html
医療法人社団清奨会ひらい歯科クリニック,047-440-8241,千葉県船橋市薬円台5-6-10,平井直毅,むし歯、根管治療、歯周病、入れ歯、小児歯科、予防・クリーニング、歯科口腔外科、矯正歯科・小児矯正、審美治療、ホワイトニング、各種マウスピース製作,https://www.hirai-shika.net/
医療法人スワン会,047-401-4433,愛知県名古屋市港区川西通5-24,河野能丈,,https://www.swankai.com/
株式会社ジャンプ企画,047-404-8638,千葉県流山市東深井236-1,吉岡佳吾,,https://jumpkikaku.site/
株式会社ハクブン,,神奈川県横浜市青葉区新石川3丁目15番11号,岩崎博文,美容室チェーンの管理・運営美容材料の仕入販売,https://hkbn.co.jp/
