社名,電話番号,所在地,代表者,事業内容,企業URL
合同会社百幸,048-972-4477,埼玉県越谷市下間久里８２０－１４,,飲食,
本格炭火焼肉レストラン南,048-966-9186,埼玉県越谷市花田２－３０－１３,,レストラン・カフェ,
株式会社パティスリー・ビィズ・ショコラ,048-989-0141,埼玉県越谷市新越谷２－１３－４,,小売・卸売・商社,
株式会社イントラスト,0570-002-118,静岡県浜松市中央区元城町２１６－１８浜松大同生命ビル５Ｆ,,不動産,
株式会社インプルーブ,053-456-8878,静岡県浜松市中央区西伊場町４７－３３ＣＰビル,,理容・美容・エステ,
有限会社ＴＡＫＥ,053-411-8080,静岡県浜松市中央区大蒲町８６－１１,,医療・病院,
有限会社ウルトラワークス,053-456-1327,静岡県浜松市中区北寺島町２１５－２２エムアイビル３階,,広告・宣伝,
株式会社エムズ,080-9714-0253,静岡県藤枝市青木２－１８－３,,看護・介護,
株式会社レンティックホールディングス,053-462-1211,静岡県浜松市中央区高林５－７－１３,,生活関連サービス,
医療法人社団新風会,053-473-6721,静岡県浜松市中央区助信町３９－１０,,病院・診療所,
藤野整形外科医院,053-471-4196,静岡県浜松市中央区城北２－１５－１２,,看護・介護,
あがた歯科,053-525-7761,静岡県浜松市中央区中央３－６－１,,歯科クリニック,http://www.agata-shika.com/
株式会社ピースフル・アイランド,053-582-9000,静岡県浜松市中央区白羽町５４７－１８,,看護・介護,
株式会社フジワーク,03-5345-7021,東京都中野区新井１－１１－２ＯＮＥＳＴ中野ビル６０３号室,,ITサービス,
株式会社ジーベック,03-5942-8155,東京都中野区新井１－３６－３フジビル２３Ｆ,,ソフトウェア開発,
株式会社スフィアリンクス,03-5942-8751,東京都中野区中野４－１０－２中野セントラルパークサウス２階,,ITサービス,
日昇ホーム株式会社,03-3336-1011,東京都中野区若宮３－１８－３,,不動産業・物件管理代行☆ホームページには社員ブログもＵＰ,
株式会社レオパレス２１,03-5350-0001,東京都中野区本町２－５４－１１,,不動産,
株式会社トータツ,03-6908-6991,東京都中野区東中野１－５８－１６東中野コーポ２０３,,不動産管理,
株式会社縁屋,03-4361-8186,東京都中野区中野５－６３－５２Ｆ,,レストラン・カフェ,
有限会社陸蒸気,03-3228-1230,東京都中野区中野５－５９－３,,飲食,
株式会社ＢＯＵＴ,03-5942-8527,東京都中野区中野５－５０－３,,レストラン・カフェ,
株式会社銀座ルノアール,03-3387-2982,東京都中野区中央４－６０－３銀座ルノアールビル,,レストラン・カフェ,
ファーストゴルフ,03-3559-3885,東京都練馬区早宮２－１７－１２,,スポーツ・レクリエーション,
ビッグエコー,03-3992-7272,東京都練馬区豊玉北５－１９－１０,,カラオケ店★カラオケDAMの第一興商最新音楽情報もGETできる★東証プライム上場企業,https://big-echo.jp/
株式会社ミリオンインターナショナル,03-3937-0008,東京都練馬区北町２－３６－２３,,公営競技・パチンコ,
りらくる,050-8883-9818,東京都練馬区旭町１－８－３,,全国600店舗以上のリラクゼーションスペースの運営,https://relxle.com
株式会社ピースホーム,03-6906-4277,東京都練馬区北町８－３７－１５スタシオン赤塚２Ｆ,,不動産仲介,
練馬加藤矯正歯科,03-6915-8895,東京都練馬区練馬１－５－４,,歯科・口腔外科医院,
株式会社クレイハート,03-3990-7723,東京都練馬区春日町５－３３－３０,,生活関連サービス,
医療法人社団ユリイカ,03-6913-3494,東京都練馬区石神井町３－２４－７岩田ビル２階,,看護・介護,
練馬きたまち内科・糖尿病内科クリニック,03-3550-7555,東京都練馬区北町３－１６－１０ソライエアイル練馬北町１階,,病院・診療所,
社会福祉法人北山会,03-3931-0008,東京都練馬区北町８－２１－１９,,看護・介護,
ひだまり薬局,073-446-0077,和歌山県和歌山市布引７６３－７,,医療・病院,
株式会社伊勢屋フーズ,073-498-8751,和歌山県和歌山市永穂３９９,,専門飲食料品小売,
株式会社池永商店,073-432-2225,和歌山県和歌山市西浜１６６０－４０９,,総合商社・専門商社・卸売,
株式会社紀陽銀行,073-426-7135,和歌山県和歌山市本町１－３５,,金融,
うまいもんや一ｈａｊｉｍｅ,073-424-3909,和歌山県和歌山市新堺丁４３－１プレミール１０１,,レストラン・カフェ,
セブンイレブン,073-461-0701,和歌山県和歌山市直川前田５１６－５,,コンビニエンスストア,
株式会社わらいや,073-422-9500,和歌山県和歌山市中之島２２４４,,飲食,
株式会社モモタロウ,073-436-3018,和歌山県和歌山市中島１８５－１コーポ中島１０３,,レストラン・カフェ,
株式会社信濃路,073-471-1088,和歌山県和歌山市新在家１４４－１,,レストラン・カフェ,
はやし歯科医院,073-424-6000,和歌山県和歌山市美園町４－６９－８,,歯科・口腔外科医院,
ホスピタリティ＆イノベーション株式会社,073-447-0001,和歌山県和歌山市新和歌浦２－４,,文化・教養・娯楽,
メイク広告株式会社,073-455-1072,和歌山県和歌山市梶取４２－１,,広告・宣伝,
中心屋母家,073-428-3330,和歌山県和歌山市十二番丁６０デュオ丸の内１Ｆ,,飲食,
医療法人ほんだ歯科,073-425-7446,和歌山県和歌山市美園町５－６１ＪＲ和歌山駅ビル４階,,歯科・口腔外科医院,
合同会社Ｒｉｌｙ,090-5961-9441,和歌山県岩出市森１２０,,飲食,
味菜うまいもんや芳文,073-474-5111,和歌山県和歌山市太田１－１３－１駅前東ビル１Ｆ,,飲食,
株式会社エヌ・アイ・シー,073-475-3300,和歌山県和歌山市太田１－１３－８エヌ・アイ・シービル６Ｆ,,理容・美容・エステ,
株式会社オークワ,073-425-2481,和歌山県和歌山市中島１８５－３,,総合スーパー,
株式会社カワ,0737-63-4792,和歌山県有田郡広川町広５０１－５,,製造・メーカー,
株式会社廣岡,0737-63-5600,和歌山県有田郡湯浅町湯浅１５９０,,ドラッグストア,
有限会社伊敷調剤薬局,099-229-1227,鹿児島県鹿児島市伊敷２－１－１２,,ドラッグストア,
みやま産業株式会社,0995-55-5558,鹿児島県霧島市国分中央３－６－７,,レストラン・カフェ,
合同会社恵悟,099-226-3751,鹿児島県鹿児島市山之口町９－３神川ビル１０２,,飲食,
合同会社Ｐ・Ｍ・Ａ,099-259-0056,鹿児島県鹿児島市田上２－３６－１８,,コンビニエンスストア,
有限会社サガタ,0090-7165-9369,鹿児島県鹿児島市武１－４３－１０,,専門飲食料品小売,
有限会社ホテル鶴屋,090-7476-3369,鹿児島県鹿児島市上福元町５５６６－２,,飲食,
有限会社尾堂酒店,099-254-0010,鹿児島県鹿児島市西田２－２－４,,コンビニエンスストア,
株式会社グロウスボンズ,099-254-0392,鹿児島県鹿児島市西田１－３－１,,レストラン・カフェ,
株式会社フクショクフーズ,099-294-9584,鹿児島県鹿児島市千日町２－１５白鹿ビル２Ｆ,,レストラン・カフェ,
株式会社剛一家,099-258-0460,鹿児島県鹿児島市武３－６－５太陽ヘルスセンター１階,,飲食,
株式会社ＢｉＭｉＷＯＲＬＤ,070-9026-6036,鹿児島県鹿児島市船津町１－２松村ビル１０１,,ケータリング・フードサービス,
ひなたスマイルケアサポーターズ株式会社,099-298-9683,鹿児島県鹿児島市若葉町１－３,,看護・介護,
アイ・エイチ・ジェイ株式会社,03-5549-1286,鹿児島県鹿児島市鴨池新町１２－１２,,通信・インターネット,
ファミリーマート,099-213-5885,鹿児島県鹿児島市田上３－３－１５,,コンビニエンスストア,
医療法人ななつ星,099-813-7897,鹿児島県鹿児島市西田１－５－１高見橋ビル１階,,歯科・口腔外科医院,
医療法人敬天会,099-220-6640,鹿児島県鹿児島市玉里団地３－１９－１１,,看護・介護,
有限会社球美,099-263-8138,鹿児島県鹿児島市武２－１２－６－７０１,,生活関連サービス,
株式会社システムファクトリーかごしま,099-206-3888,鹿児島県鹿児島市中央町２２－１６アエールプラザ４階,,通信・インターネット,
社会福祉法人坂栄寿会,099-298-9674,鹿児島県鹿児島市坂元町２８－５,,保育・幼児教育,
株式会社リンクス,099-251-1100,鹿児島県鹿児島市中央町１５－２４,,ホテル・旅館,
キンダイ観光株式会社,0859-34-4347,鳥取県米子市両三柳２２２－１,,公営競技・パチンコ,
個別指導ミライズ合同会社,0859-36-8986,鳥取県米子市加茂町２－１８０,,教育支援サービス,
大黒天物産株式会社,086-435-1100,岡山県倉敷市西中新田２９７－１,,スーパーマーケット,
,090-1011-0584,島根県松江市寺町２０６－１５,,レストラン・カフェ,
有限会社すみれ調剤薬局,0852-54-9191,島根県松江市西津田１０－１７－２０－２,,医療・病院,
有限会社信愛フードサービス,0853-21-8710,島根県出雲市浜町５６７－１,,飲食,
有限会社桃仙閣,0852-21-3946,島根県松江市浜乃木６－１３－１,,飲食,
東京靴株式会社,0852-52-6688,島根県松江市東出雲町出雲郷１６４３－４,,百貨店・アパレル小売,
松川商事株式会社,0859-33-3131,鳥取県米子市両三柳２３６６－４,,書籍・レコード・ゲームソフト小売,
株式会社ふたば,084-999-8333,広島県福山市千田町千田２２１１－２,,食品・飲料メーカー,
株式会社めのや,0852-61-3141,島根県松江市玉湯町湯町１７５５－１,,ギフト・土産物小売,
株式会社アミパラ,086-242-4433,岡山県岡山市南区泉田５－３－８,,芸術・娯楽・レクリエーション,
株式会社オシジア,0853-31-8500,島根県出雲市渡橋町１２１１,,飲食,
株式会社セツ,0857-50-0900,鳥取県鳥取市南隈４０８,,飲食,
株式会社ファンフロンティア,0852-20-2828,島根県松江市上乃木５－１８－３１,,レストラン・カフェ,
株式会社フロイデ,086-426-1473,島根県松江市袖師町２－５０－３０３,,レストラン・カフェ,
株式会社ブロックスインダストリー,0852-76-2399,島根県松江市八束町入江,,飲食,
株式会社ホテル・アルファーワン出雲,0853-21-7722,島根県出雲市今市町９７１－３,,ホテル・旅館,
株式会社モットスマイル,0852-67-2259,島根県松江市山代町１０１７,,レストラン・カフェ,
株式会社ＴｒｕｓｔＧｒｏｗｔｈ西日本,082-258-5734,広島県広島市中区大手町５－２－２２山陽ビル２号館２階,,人材派遣・職業紹介,
ゆめはな,080-4550-1776,新潟県上越市本町２,,理容・美容・エステ,
二葉商事株式会社,025-525-1105,新潟県上越市本町５－３－２７,,レストラン・カフェ,
介護老人保健施設そよかぜ倶楽部,025-522-8700,新潟県上越市今泉西蓮池１３１０－５,,看護・介護,
株式会社アミング,076-254-5400,石川県金沢市無量寺５－５４－３,,ギフト・土産物小売,
株式会社エヌ・エム・アイ,0258-28-2538,新潟県長岡市緑町１－３８－２８３,,病院・診療所,
株式会社エム・アイ・ディジャパン,025-521-2688,新潟県上越市上島４６９－１,,公営競技・パチンコ,
株式会社キャリアシステム,076-292-0111,石川県金沢市玉鉾３－２９,,人事・人材サービス,
株式会社キャリアステーション,025-229-4171,新潟県新潟市中央区上大川前通６－１２１４－２大同生命新潟ビル５Ｆ,,人材派遣・職業紹介,
株式会社三宝,025-377-3636,新潟県新潟市西区鳥原１８３０－１,,レストラン・カフェ,
株式会社ハートレイドジャパン,025-521-2800,新潟県上越市岩木３１０－３,,飲食,
株式会社第一実業,025-275-3611,新潟県新潟市東区卸新町１９２７－２６,,公営競技・パチンコ,
株式会社飛田観光開発,025-526-2882,新潟県上越市中田原80-28,,飲食,
株式会社ＨＭＳユナイテッド,025-528-3455,新潟県上越市今池97-2,,人事・人材サービス,
株式会社ＮＳＧアカデミー,025-241-1713,新潟県新潟市中央区笹口1-20-8小林ビル,,教育支援サービス,
株式会社Otte,090-1938-1910,新潟県長岡市巻島町2511,,理容・美容・エステ,
株式会社QUADFOODS,0256-33-0067,新潟県三条市本町4-1-8,,飲食,
株式会社TR企画,025-374-7320,新潟県新潟市東区大形本町5-16-10リヴェールおおがた2F,,ホテル・旅館,
次世代型個別塾Teams,0258-94-7162,新潟県長岡市旭町2-2-1,,教育支援サービス,
石本商事株式会社,025-285-6221,新潟県新潟市中央区上近江3-19-22,,飲食,
Ｄｅｓｓｅｒｙ,090-5119-1672,新潟県上越市本町２－２－２７,,理容・美容・エステ,
イオンリテール株式会社,043-212-6500,千葉県千葉市美浜区中瀬1-5-1,,総合スーパー,
スイスポートジャパン株式会社,0476-33-8755,千葉県成田市古込1-1,,航空運輸・空港運営,
セントケア千葉株式会社,043-203-0720,千葉県千葉市中央区新町１－１７ＪＰＲ千葉ビル１２Ｆ,,市民・ソーシャルサービス,
ホワイトニングショップ,0476-50-2250,千葉県成田市囲護台2-2-17山倉ビル2F,,生活関連サービス,
ワールドホテルマネージメント株式会社,0476-20-4325,千葉県成田市東町121-11,,航空運輸・空港運営,
台湾料理鼎,0476-26-2631,千葉県成田市公津の杜3-6-5-103,,レストラン・カフェ,
外食計画ホールディングス株式会社,043-306-3316,千葉県千葉市中央区富士見2-22-7,,レストラン・カフェ,
株式会社オオクシ,043-204-1601,千葉県千葉市,,理容・美容・エステ,
株式会社オダカ,047-358-5311,千葉県市川市本行徳9-15,,小売・卸売・商社,
株式会社ビクトリー,043-203-5780,千葉県千葉市中央区新町4-7クレインヒルズ2階,,理容・美容・エステ,
株式会社フォーラム商事,0476-24-0101,千葉県成田市囲護台1-1-2,,ホテル・旅館,
株式会社ヤックスケアサービス,043-248-0810,千葉県千葉市中央区問屋町1-35ポートサイドタワー28階,,看護・介護,
株式会社京葉学院,043-244-1049,千葉県千葉市中央区新千葉2-8-7京葉学院本部ビル,,教育支援サービス,
株式会社富田,047-368-8860,千葉県松戸市松戸,,レストラン・カフェ,
株式会社銚子丸,043-350-1266,千葉県千葉市美浜区浜田2-39,,飲食,
株式会社Ｓｐｌｕｓ,0476-37-4453,千葉県成田市美郷台3-1-27,,レストラン・カフェ,
社会福祉法人下総会,0476-96-4165,千葉県成田市名木192,,看護・介護,
ＡｎｉｍａｌＷｅｌｌｎｅｓｓＣｌｉｎｉｃ,080-3296-2104,千葉県成田市東町１３３イオンタウン成田富里１Ｆ,,病院・診療所,
GENcompany株式会社,070-2314-2223,千葉県いすみ市岬町和泉656-4,,レストラン・カフェ,
SAINTCARECHIBAINC.,043-203-0720,千葉県千葉市中央区新町1-17JPR千葉ビル12F,,生活関連サービス,
株式会社グローバルヒューマンブリッジ,03-5774-9111,東京都渋谷区神宮前6-27-8京セラ原宿ビル2階,友永幸一,・総合人材サービス・人材派遣・人材紹介・業務請負労働者派遣事業／派27-304982有料職業紹介事業/27-ユ-303747,https://global-human.jp/
株式会社雷門満留賀,03-3842-2020,東京都台東区浅草1-1-5,関田光弘,飲食店の運営,
StudioVerde合同会社,,東京都墨田区業平1-6-3,,広告・出版等のための商業写真・宣伝写真撮影,
コウセイ合同会社,042-595-8380,東京都武蔵野市緑町1-4-10401,,サブウェイ等の運営,
かぶら屋西所沢店,04-2968-3900,埼玉県所沢市西所沢1-12-3,北村文吾,飲食,https://www.kaburaya.co.jp/
株式会社コウトン,042-227-6280,東京都武蔵野市緑町1-4-10401,,サブウェイ等の運営,
株式会社SKINGARDEN,,東京都新宿区百人町2-1-2K-PLAZA2,李宣璋,,https://skingarden.co.jp/
みつわビル管理株式会社,0859-29-7891,鳥取県米子市安倍22-1,,生活関連サービス,
キンダイ観光株式会社,0859-34-4347,鳥取県米子市両三柳222-1,,公営競技・パチンコ,
タスクアライブ株式会社,0836-38-3288,山口県宇部市相生町9-21,,人材派遣・職業紹介,
有限会社エム・エム,0859-26-1634,鳥取県米子市永江160-1,,飲食,
有限会社クリーンサービス山陰,0859-24-9331,鳥取県米子市旗ケ崎7-22-50,,生活関連サービス,
有限会社マツウラ,084-928-9003,広島県福山市光南町1-5-16,,セキュリティー・警備サービス,
有限会社メディカルフロンティア,0859-24-4652,鳥取県米子市河崎611-6,,飲食,
有限会社玉木製麺,0853-72-0653,島根県出雲市斐川町沖洲１６２０,,飲食,
有限会社ＡＧＳ,0852-53-0066,島根県松江市東出雲町出雲郷808-12F,,飲食,
有限会社ＳＵＮＡＢＡＣＯＭＰＡＮＹ,0857-30-4771,鳥取県鳥取市湖山町東４－２８－２,,レストラン・カフェ,
株式会社ウッドベル,0853-53-4731,島根県出雲市大社町杵築西2671-1,,レストラン・カフェ,
株式会社ツルハグループ,082-270-3170,広島県広島市西区井口明神1-11-10,,ドラッグストア,
株式会社ビューティ・アール,0859-32-5185,鳥取県米子市米原8-10-43,,理容・美容・エステ,
株式会社ファンフロンティア,0852-20-2828,島根県松江市上乃木5-18-31,,レストラン・カフェ,
株式会社フラワーランド,0852-31-6700,島根県松江市東出雲町出雲郷470-1,,ホテル・旅館,
株式会社ホテルマネージメント米子,0859-38-3700,鳥取県米子市久米町５３－２,,ホテル・旅館,
株式会社三栄,0852-53-0777,島根県松江市東出雲町出雲郷７４７－６,,飲食,
株式会社栄光電通,0859-25-3600,鳥取県米子市大篠津町689-2,,通信・インターネット,
桜丸,0859-33-5777,鳥取県米子市明治町224-1つるだやビル1F,,飲食,
kininalu株式会社,0859-21-1250,鳥取県米子市明治町273,,レストラン・カフェ,
有限会社玉木製麺,0853-72-0653,島根県出雲市斐川町沖洲1620,,飲食,
有限会社AGS,0852-53-0066,島根県松江市東出雲町出雲郷808-12F,,飲食,
有限会社paardenbloem,082-258-3290,広島県広島市南区的場町1アートビル10階,,人材派遣・職業紹介,
株式会社アビリティーライフ,082-568-5220,広島県広島市南区段原3-9-25コンフォートＮビル2F,,理容・美容・エステ,
株式会社シナジーワーク,0852-33-7310,島根県松江市西川津町612-12,,小売・卸売・商社,
株式会社フラワーランド,0852-31-6700,島根県松江市東出雲町出雲郷470-1,,ホテル・旅館,
株式会社マテリアル,086-201-4116,岡山県岡山市南区新保1611-1,,人事・人材サービス,
株式会社ユニバーサル,086-272-1955,岡山県岡山市中区浜1-2-5,,ホテル・旅館,
株式会社三栄,0852-53-0777,島根県松江市東出雲町出雲郷747-6,,芸術・娯楽・レクリエーション,
株式会社丸三,0853-25-0333,島根県出雲市渡橋町706-1,,芸術・娯楽・レクリエーション,
株式会社今井書店,0852-24-2231,島根県松江市殿町63,,レストラン・カフェ,
淀川食品株式会社,082-255-9551,広島県広島市南区旭2-17-37,,食品・飲料メーカー,
結び株式会社,0852-52-2340,島根県松江市東出雲町揖屋2299-4,,レストラン・カフェ,
サインポスト合同会社,0852-61-6300,島根県松江市東出雲町意宇東1-6-3,,看護・介護,
ジェイエイ・トービス株式会社,0566-98-2558,愛知県安城市今本町西向山28,,配送・トラック輸送,
コメダ珈琲店,0566-74-1146,愛知県安城市錦町33,,レストラン・カフェ,
サガミレストランツ株式会社,052-737-6000,愛知県名古屋市守山区八剣2-118,,レストラン・カフェ,
ワンダーフードイノベーション株式会社,052-932-8431,愛知県名古屋市東区徳川1-9-30,,レストラン・カフェ,
株式会社カトー,0566-70-7258,愛知県安城市福釜町蓬野2-11,,飲食,
マルスフードショップ株式会社,0569-47-7511,愛知県知多郡阿久比町福住高根台35-6,,スーパーマーケット,
有限会社かねぶん,0566-98-4649,愛知県安城市今本町4-10-18,,レストラン・カフェ,
ローソン,0566-74-1828,愛知県安城市篠目町溝川25-1,,コンビニエンスストア,
株式会社イトウ珈琲商会,052-962-3541,愛知県名古屋市東区泉１－７－２５,,レストラン・カフェ,
中部薬品株式会社,0572-27-3911,岐阜県多治見市高根町4-29,,ドラッグストア,
ABホテル株式会社,0566-79-3013,愛知県安城市三河安城町1-9-2第2東祥ビル6階,,ホテル・旅館,
来来亭,0566-77-7456,愛知県安城市横山町八左231-3,,レストラン・カフェ,
蕎麦切りさとう,0566-72-2126,愛知県安城市弁天町1-12弁天ビル1F,,レストラン・カフェ,
株式会社ノーブルフォレスト,0564-53-8885,愛知県岡崎市上和田町北天白29-1,,専門飲食料品小売,
株式会社タカテック,080-4305-1782,愛知県名古屋市守山区廿軒家15-22エレストビル2F,,生活関連サービス,
安城接骨院,0566-70-7075,愛知県安城市昭和町17-22A号室,,病院・診療所,
株式会社めんや,0561-72-5850,愛知県日進市岩崎町大廻間2-1,,ケータリング・フードサービス,
蕎麦や石はら,0566-76-2007,愛知県安城市安城町東広畔70-1,,飲食,
株式会社ファイブレシピ,052-209-6855,愛知県名古屋市中区丸の内1-16-2,,レストラン・カフェ,
株式会社日本ナーサリー支援機構,052-252-8051,愛知県名古屋市中区栄２－２－１,,人事・人材サービス,
クラギ株式会社,0598-26-1111,三重県松阪市川井町,,小売・卸売・商社,
伊勢低温輸送株式会社,0598-61-2200,三重県松阪市稲木町522-3,,物流・運行管理,
伊勢湾マリン開発株式会社,059-224-1577,三重県津市桜橋3-53-1,,スポーツ・レクリエーション,
八昇製菓株式会社,0598-51-1260,三重県松阪市大口町新地1510-45,,食品・飲料メーカー,
合同会社ＭＪＰＬＵＳ,080-6644-7560,三重県鈴鹿市大池3-11-9,,配送・トラック輸送,
居酒屋がじゅ丸,0598-26-0339,三重県松阪市日野町７４２－１鳥本ビル１Ｆ,,飲食,
有限会社ヒロ・コーポレーション,0598-60-0873,三重県松阪市久保町1887-86,,教育支援サービス,
有限会社アイ・エス・ビー,0598-50-1201,三重県松阪市,,レストラン・カフェ,
有限会社山喜,0598-22-2333,三重県松阪市御殿山町902-158,,レストラン・カフェ,
有限会社岡金フードサービス,0598-50-5115,三重県津市久居中町268-1,,飲食,
松山神経内科,0598-25-6800,三重県松阪市川井町728-8,,病院・診療所,
株式会社ぎゅーとら,0596-37-5500,三重県伊勢市西豊浜町６５５－１８,,スーパーマーケット,
株式会社アクアメディカル,0598-58-3245,三重県松阪市伊勢寺町481-6,,医療・病院,
株式会社アルファサービス,059-350-3010,三重県四日市市鵜の森1-5-16HOWAビル,,レストラン・カフェ,
株式会社ウィーポック,0598-30-6010,三重県松阪市田村町235-1,,小売・卸売・商社,
株式会社エムエスケー,0598-30-6666,三重県松阪市下村町1041-3,,ソフトウェア開発,
株式会社ベルハート,0598-53-1122,三重県松阪市大口町1510-10,,看護・介護,
CYS.Hair,0598-38-7770,三重県多気郡多気町相可１３６５－１,,理容・美容・エステ,
株式会社味園,0598-51-8100,三重県松阪市京町一区１７－９,,飲食,
株式会社LAND･HO,0598-22-2020,三重県松阪市五反田町1-1277-1,,ギフト・土産物小売,
,,,,,
株式会社出雲商会,03-3843-8751,東京都台東区雷門2丁目18-15,西海應道,香と数珠の専門店の運営,
うどん処春日,088-883-2224,高知県高知市知寄町1-4-37,,飲食,
こはるびより,088-855-5899,高知県高知市追手筋1-6-11,,飲食,
マルエイフーズ株式会社,088-820-5307,高知県高知市長浜4404-5,,レストラン・カフェ,
伊予鉄総合企画株式会社,088-871-7760,愛媛県松山市三番町４－９－５松山センタービル,,人事・人材サービス,
医療法人みずほ会,0889-43-1001,高知県須崎市多ノ郷甲5748-1,,看護・介護,
株式会社やまおか,088-872-9677,高知県香美市土佐山田町416-1,,飲食,
株式会社カノープス,088-863-1477,高知県南国市大そね甲1365,,百貨店・アパレル小売,
株式会社TKIフーズ,088-871-5710,高知県高知市高須新町2-3-7,,飲食,
